{
    "phase": "design",
    "architectural_changes": [
        {
            "component": "AuthModule",
            "change_type": "NEW",
            "description": "Handles token generation and verification"
        },
        {
            "component": "UserSchema",
            "change_type": "MODIFY",
            "description": "Add password_hash field"
        }
    ],
    "component_impact": [
        "Database",
        "API Docs"
    ],
    "alternatives_considered": [
        {
            "name": "Custom Token Headers",
            "pros": [
                "Simpler to implement"
            ],
            "cons": [
                "Not standard",
                "No OpenAPI support"
            ],
            "selected": false
        }
    ]
}